{"$schema":"https://json-schema.org/draft/2020-12/schema","type":"object","additionalProperties":false,"required":["schema_version","order_id","hypothesis_id","evidence_tier","edge_claim","mode","metadata","schedule","validation_seal","access_counters"],"properties":{"schema_version":{"const":"lily_l3_b714_date_only_schedule_attestation_v6"},"order_id":{"const":"B7.14R4"},"hypothesis_id":{"const":"L-3"},"evidence_tier":{"const":"E0"},"edge_claim":{"const":"none"},"mode":{"const":"synthetic_preflight_pass"},"metadata":{"type":"object","additionalProperties":false,"required":["path","sha256"],"properties":{"path":{"const":"tests/fixtures/l3_b714_v6/metadata.json"},"sha256":{"type":"string","pattern":"^[0-9a-f]{64}$"}}},"schedule":{"type":"object","additionalProperties":false,"required":["common_sessions","selected_decision_dates","execution_dates","t_plus_20_dates","date_evidence_sha256"],"properties":{"common_sessions":{"type":"array","items":{"type":"string"}},"selected_decision_dates":{"type":"array","items":{"type":"string"}},"execution_dates":{"type":"array","items":{"type":"string"}},"t_plus_20_dates":{"type":"array","items":{"type":"string"}},"date_evidence_sha256":{"type":"string","pattern":"^[0-9a-f]{64}$"}}},"validation_seal":{"type":"object","additionalProperties":false,"required":["status","accessed"],"properties":{"status":{"const":"sealed_not_accessed"},"accessed":{"const":false}}},"access_counters":{"type":"object","additionalProperties":false,"required":["real_container_access_count","return_decode_count","research_decision_count","ledger_row_count","validation_access_count","new_schedule_attestation_count"],"properties":{"real_container_access_count":{"const":0},"return_decode_count":{"const":0},"research_decision_count":{"const":0},"ledger_row_count":{"const":0},"validation_access_count":{"const":0},"new_schedule_attestation_count":{"const":0}}}}}

