{"schema_version":"lily_l3_b714_date_only_schedule_attestation_v6","order_id":"B7.14R4","hypothesis_id":"L-3","evidence_tier":"E0","edge_claim":"none","mode":"synthetic_preflight_pass","metadata":{"path":"tests/fixtures/l3_b714_v6/metadata.json","sha256":"ccfd14f9f7fe29f593fef5a01d9ac9347199fc986b7c852af5692000fecd0c47"},"schedule":{"common_sessions":["2007-02-05","2007-02-06","2007-02-07","2007-02-08","2007-02-09","2007-02-12","2007-02-13","2007-02-14","2007-02-15","2007-02-16","2007-02-19","2007-02-20","2007-02-21","2007-02-22","2007-02-23","2007-02-26","2007-02-27","2007-02-28","2007-03-01","2007-03-02","2007-03-05","2007-03-06","2007-03-07","2007-03-08","2007-03-09"],"selected_decision_dates":["2007-02-09"],"execution_dates":["2007-02-12"],"t_plus_20_dates":["2007-03-09"],"date_evidence_sha256":"65fb046aff4746750cbc1a611b329e00b24afb5f98863f801ec4de766224d56f"},"validation_seal":{"status":"sealed_not_accessed","accessed":false},"access_counters":{"real_container_access_count":0,"return_decode_count":0,"research_decision_count":0,"ledger_row_count":0,"validation_access_count":0,"new_schedule_attestation_count":0}}
